,title,abstract,paragraph,pub_date
588,Abortion Doctor’s Murder Trial Opens,"Dr. Kermit Gosnell, who operated a women’s health clinic in West Philadelphia, is accused of performing illegal late-term abortions and killing seven viable fetuses.","PHILADELPHIA — In opening statements in court on Monday, prosecutors charged that a doctor who operated a women’s health clinic here killed seven viable fetuses by plunging scissors into their necks and “snipping” their spinal cords and was also responsible for the death of a pregnant woman in his care. ",2013-03-19T02:27:42+0000
589,Abortion Reform,ed backs Blumenthal bill,,1967-02-14T05:00:00+0000
590,A Dangerous Game On Abortion,"Can there be a truce in the abortion wars? A lot of people would like to think so. Bob Dole hopes that adding a rider on tolerance will take the sting out of the plank in the Republican platform that calls for a ban on all abortion. The feminist writer Naomi Wolf wants pro-choicers to acknowledge abortion as a ""sin"" and ""moral iniquity"" that is sometimes necessary, but sometimes a selfish indulgence. The Common Ground Network for Life and Choice tries to get activists on both sides to lower the decibel level, so that they can work together to lower the rate of unwanted pregnancies.         Calming the waters is a goal that plainly appeals to those who are tired of the abortion debate: Common Ground's tiny following (300 active members) received plenty of rapturous press for its conference in Madison, Wis., earlier  this month.   ","Can there be a truce in the abortion wars? A lot of people would like to think so. Bob Dole hopes that adding a rider on tolerance will take the sting out of the plank in the Republican platform that calls for a ban on all abortion. The feminist writer Naomi Wolf wants pro-choicers to acknowledge abortion as a ""sin"" and ""moral iniquity"" that is sometimes necessary, but sometimes a selfish indulgence. The Common Ground Network for Life and Choice tries to get activists on both sides to lower the decibel level, so that they can work together to lower the rate of unwanted pregnancies.",1996-06-18T05:00:00+0000
591,Next Front Line in the Abortion Wars: State Supreme Courts,"Court challenges to sweeping rollbacks of abortion rights must go through state supreme courts, many of which have been shaped by years of conservative activism.","WASHINGTON — Fresh from the political thicket of the United States Supreme Court, the struggle over abortion is now moving to venues that are poised to become the next front line in the country’s partisan warfare: state supreme courts.",2022-07-06T07:00:11+0000
592,Gore Abortion Scramble,"Vice Pres Al Gore chooses dramatic way to demonstrate his support for abortion rights, diverting his campaign from New York to race back to Washington to be on hand for possible tie vote in Senate; as it turns out, his vote is not needed (M)","Vice President Al Gore chose a dramatic way today to demonstrate his support for abortion rights, diverting his campaign from New York to race back to Washington to be on hand for a possible tie vote in the Senate, jumping on a commercial flight (with an aide ferrying the nation's nuclear codes) for the trip.",2000-02-03T05:00:00+0000
593,Abortion Ban to Be Weighed,New Jersey Senate will consider bill to ban a late-term abortion procedure; Gov Whitman opposes measure and says she will veto bill unless it includes exception to protect health of mother (S) (New Jersey Daily Briefing),The State Senate will consider a bill today to ban a late-term abortion procedure.,1997-06-16T05:00:00+0000
594,Arrests in Abortion Protest,"Englewood (NJ) police say that five days after group of anti-abortion activists are arrested for trespassing at abortion clinic in Englewood, four more are arrested at same clinic; clinic, Metropolitan Medical Associates, attracted national attention last September after it was reported that it had performed 1,500 late-term abortions each year (S) (New Jersey Daily Briefing)","Five days after a group of anti-abortion activists were arrested for trespassing in an abortion clinic in Englewood, four more were arrested at the same clinic yesterday, Englewood police said. Six of the 15 protesters arrested on Saturday were still in the Bergen County jail, where they were not formally accused because they would not give their names. The clinic, Metropolitan Medical Associates, attracted national attention last September after it was reported that it had performed 1,500 late-term abortions each year. In Trenton yesterday, a bill to ban the procedures was approved by the Assembly Health Committee.",1997-01-24T05:00:00+0000
595,What New Abortion Bans Mean for the Youngest Patients,"One 10-year-old became the focus of debate, but more than 1,000 girls under 15 seek abortions each year. “How are we going to help the pregnant kids?”","She was just 10 years old, so young that many people were horrified when they heard it, and others refused to believe it. But the ordeal of the child rape victim in Ohio who had to cross state lines for an abortion, and the ugly political fight that followed, have highlighted two uncomfortable facts: Such pregnancies are not as rare as people think, and new abortion bans are likely to have a pronounced impact on the youngest pregnant girls.",2022-07-16T19:40:14+0000
596,Reopening an Abortion Debate,Editorial urges Congress not to ban partial-birth abortion; says ban would be an unacceptable political invasion of private medical decisions and attempt to limit access to abortion (M),"Republicans in Congress are expected to reintroduce legislation this week to ban the abortion procedure that they describe as ''partial-birth abortion'' but whose technical name is ''intact dilation and extraction.'' Both houses of Congress passed the bill last year, but it was vetoed by President Clinton after a heated debate that pitted the gruesomeness of the procedure against the right of women to choose the best means of abortion in consultation with their doctors.",1997-03-03T05:00:00+0000
597,Against Abortion,reply opposes abortion,,1969-04-07T05:00:00+0000
598,A Salvadoran at Risk Tests Abortion Law,The case of a young woman with a high-risk pregnancy who is awaiting a Salvadoran Supreme Court ruling has become a focal point in a broad battle over abortion in Latin America.,"MEXICO CITY — Beatriz spends her days in a hospital room, anxiously watching her belly grow.",2013-05-29T02:22:46+0000
599,G.O.P. Avoids an Open Debate on Abortion,"  The Bush campaign managed to avoid an open debate on the abortion issue at the Republican convention today by appealing to the loyalty of leaders of pivotal state delegations who themselves favor abortion rights.   Polls of delegates show that only a few favor the rigid position on abortion taken in the party's platform, and the Bush camp took pains to place some distance between the President and the platform.",The Bush campaign managed to avoid an open debate on the abortion issue at the Republican convention today by appealing to the loyalty of leaders of pivotal state delegations who themselves favor abortion rights.,1992-08-18T05:00:00+0000
600,Abortion,"J Deedy revs RC Ch position on recent US Sup Ct decision on abortion; RC bishops have served notice on civil authorities that they consider Ct's ruling 'erroneous, unjust and immoral'; condone civil disobedience to civil laws that may require abortion and warn that any Caths who undergo or are party to abortions are automatically excommunicated from ch and will be excluded from sacraments and barred from having Cath burial; illus","Since the establishment of American Roman Catholic Hierarcl in 1789, the bishops have been virtu apostles of respect for civil lai Thus, the action the bishops took abortion last week was without pre edent in American Catholic history.",1973-02-18T05:00:00+0000
601,Spain Steps Into Battle With Itself on Abortion,"Spain’s prime minister has been working to ease the country’s restrictive abortion law, outraging the Roman Catholic Church.","MADRID  One day last month, Sister María Victoria Vindel gave her 15-year-old students a shockingly graphic lecture on reproductive health: PowerPoint slides of dismembered and disfigured fetuses interspersed with biblical quotations and pictures of a grinning José Luis Rodríguez Zapatero, Spain’s prime minister. ",2009-04-11T01:05:09+0000
602,I Couldn’t Turn My Abortion Into Art,"I believed completely in a woman’s right to choose, but I didn’t know what a brutal choice it was.",I had just turned 22 and I had the self-esteem of a squashed toad. This may explain why I was having an affair with a married 36-year-old sound mixer whom I’d met on a film shoot a couple of months earlier.,2014-07-03T00:01:05+0000
603,Partial-Birth Abortion Ban,Sampling of reader response to issue of New Jersey Assembly override of veto of law banning partial-birth abortions (M),The Assembly recently overrode the Governor's veto of a bill that bans ''partial-birth abortions.'' Should the ban be law?,1998-01-04T05:00:00+0000
604,Opposition to Abortion Ban,Medical Society of New Jersey announces its opposition to bill that would ban procedure that abortion opponents describe as partial-birth abortion (New Jersey Daily Briefing) (S),The Medical Society of New Jersey announced its opposition yesterday to a bill that would ban a procedure that abortion opponents describe as partial-birth abortion.,1997-06-19T05:00:00+0000
605,Protection for Abortion Clinics,Editorial supports legislation proposed by Gov George Pataki to protect women and doctors against violence at abortion clinics in New York (M),"Gov. George Pataki of New York took an important stand by proposing new state legislation to protect women and doctors against violence at abortion clinics. The Democratic-controlled State Assembly has passed similar legislation every year since 1993, but it has repeatedly died in the Republican-controlled Senate. The Governor has voiced support for such legislation in the past. Now he must demand that the Senate take up and approve this measure.",1998-11-22T05:00:00+0000
606,The Bombing of Abortion Rights,"Editorial deplores fatal bombing of abortion clinic in Birmingham, Ala (M)","The bombing that killed an off-duty policeman moonlighting as a security guard at an abortion clinic in Birmingham, Ala., and critically wounded a nurse on her way to work is yet another reminder that 25 years after the Supreme Court's decision in Roe v. Wade, the right of women to control their reproductive lives remains a target of violence. Just a year ago, two bombs exploded an hour apart, injured six people and left an Atlanta clinic that performed abortions in ruins.",1998-01-31T05:00:00+0000
607,"On Sotomayor, Some Abortion Rights Backers Are Uneasy",Some abortion-rights leaders are expressing unease that Judge Sonia Sotomayor might not be a reliable vote to uphold Roe v. Wade if she is approved for the Supreme Court.,"WASHINGTON  In nearly 11 years as a federal appeals court judge, President Obama’s choice for the Supreme Court, Sonia Sotomayor, has never directly ruled on whether the Constitution protects a woman’s right to an abortion. But when she has written opinions that touched tangentially on abortion disputes, she has reached outcomes in some cases that were favorable to abortion opponents.",2009-05-27T23:30:45+0000
608,Republicans Should Pay a Political Price for Abortion Bans,Kansas voters point the way for Democrats.,"The right to an abortion is protected in the Kansas State Constitution and on Tuesday, a decisive majority of voters kept it there. Fifty-nine percent of Kansans who went to the polls voted to reject a constitutional amendment that would have opened the door to full abortion bans of the kind that exist in neighboring states like Missouri and Oklahoma.",2022-08-06T14:09:05+0000
609,South Dakota to Revisit Restrictions on Abortion,"A revamped ballot measure to restrict abortions in the state will allow some exceptions for rape and incest, exceptions that some said caused a 2006 measure to fail.","Voters in South Dakota this fall will once again be asked to consider a sweeping limit on abortion, the secretary of state announced on Friday. The new proposal is widely seen as a direct challenge to Roe v. Wade, the 1973 Supreme Court decision that made abortion legal. ",2008-04-26T04:00:00+0000
610,Forbes Focuses on Abortion,"Republican presidential candidate Steve Forbes, virtually assured of second-place finish in Iowa caucuses, presses campaign against frontrunner, Gov George W Bush (S)","Virtually assured of coming in second, Steve Forbes continued today to push hard on his anti-abortion views and accused Gov. George W. Bush of attacking him with negative phone calls and advertisements.",2000-01-24T05:00:00+0000
611,24-Hour Wait for Abortion,Readers comment on proposed New Jersey law that would require 24-hour waiting period for abortion (S),What do you think of a proposed state law to require that a woman wait 24 hours before getting an abortion?,1998-02-15T05:00:00+0000
612,Abortion Harassers as Racketeers,"Editorial contends that Federal jury's verdict that Operation Rescue, Pro-Life Action League and their leaders violated Federal racketeering law in harassing abortion clinics should offer some badly needed protection for women and their doctors; maintains that use of RICO in abortion case has raised legitimate concern that this precedent could be expanded to obstruct free speech and political protest (M)","A Federal jury's verdict that two militant anti-abortion groups and their leaders violated the Federal racketeering law in harassing abortion clinics should offer some badly needed protection for women and their doctors. The class-action lawsuit brought by the National Organization for Women and two clinics in Delaware and Wisconsin was filed 12 years ago to stop Operation Rescue and the Pro-Life Action League from waging a nationwide campaign to shut down hundreds of clinics through intimidation, threats and acts of violence. The case was unusual because it was brought under the Federal Racketeer Influenced and Corrupt Organizations Act, a statute not originally intended for use against political protest movements.",1998-04-23T05:00:00+0000
613,Albuquerque Has Renewal of Attacks on Abortion,"A rash of attacks on abortion and family planning clinics has struck Albuquerque this month, the first such violence there in nearly a decade.","A rash of attacks on abortion and family planning clinics has struck Albuquerque this month, the first such violence there in nearly a decade.",2007-12-28T05:00:00+0000
614,Woman Rejects an Abortion,"Richard Collier, lawyer appointed by NJ Superior Court to represent fetus in highly unusual proceeding after fetus's mother who is charged with heroin dealing was permitted to leave jail to have abortion, says Sonya Jackson has decided not to have abortion (New Jersey Daily Briefing) (S)","Richard Collier, a lawyer, said yesterday that he was pleased to learn that his client no longer requires his services.",1997-02-06T05:00:00+0000
615,States' Wrongs on Abortion,Editorial warns that abortion opponents in state legislatures around country are winning stealth war to limit women's constitutional right to choose; says right to choose requires extra vigilance (M),"Although the debate about national abortion policy is the one drawing headlines, the real action on abortion today is not in Washington but in the states. In state legislatures around the country, abortion's opponents are winning a stealth war to limit women's right to choose. In many states, access to abortion is now prohibitively daunting for all but a small percentage of women. Today 84 percent of American counties have no abortion providers. North Dakota's only abortion doctor lives out of state and flies to Fargo once a week. In many states, women must drive four or five hours to the nearest clinic.",1996-09-03T05:00:00+0000
616,Anti-Abortion Fliers,"After it was reported on Dec 12 that anti-abortion flier had recently turned up in few boxes of cereal and cake mix, police receive calls from other people in several northern New Jersey communities who had found unwelcome message in their groceries (New Jersey Daily Briefing) (S)","After it was reported yesterday that a graphic anti-abortion flier had recently turned up in a few boxes of cereal and cake mix, police began receiving calls from other people who had found an unwelcome message in their groceries, police said. The flier, found in items purchased at supermarkets in several northern New Jersey communities, contains drawings of a late-term abortion, said Joseph J. Delaney, the police director of Ramsey. The most recent incident of the 20 reported so far, occurred on Wednesday, when a Fair Lawn woman found a flier in a copy of The Record of Hackensack, which first reported the discoveries, Mr. Delaney said.",1996-12-13T05:00:00+0000
617,"Sex, Abortion and Moral Values","Alvin Klein reviews premiere production of Kathleen Tolan play A Girl's Life, performed by Connecticut Repertory Theater, at Harriet S Jorgensen Theater in Storrs; Tolan comments; photo (M)","JEN, a 17-year-old, is pregnant. Terry, the 25-year-old father of the child she does not want, is a pro-lifer. Ken, Jen's father, mouths off about moral values, but he is manager of a pharmaceutical company that is under pressure to ban a controversial abortion pill. The company is sponsoring an international conference on health, with an emphasis on population control.",1998-10-11T05:00:00+0000
618,Justice Dept. Sues Idaho Over Its Abortion Restrictions,The Biden administration filed its first new litigation to protect access to abortion since the Supreme Court ruling in June that ended the constitutional right to terminate pregnancies.,WASHINGTON — The Biden administration sued Idaho on Tuesday over a strict state abortion law set to take effect this month that the Justice Department said would inhibit emergency room doctors from performing abortions that are necessary to stabilize the health of women facing medical emergencies.,2022-08-02T19:02:00+0000
619,Doctor’s Killer Puts Abortion on the Stand,Scott Roeder’s lawyers want jurors to consider his opposition to abortion as a valid motive for murder.,"WICHITA, Kan.  Scott Roeder, the man charged with murder in the shooting of George R. Tiller, one of the few doctors in the country to perform late-term abortions, took the witness stand in his own defense on Thursday, and said that, yes, he did it.",2010-01-28T20:30:42+0000
620,Abortion Pill Advances,The New York group holding the American patent rights to the French abortion  pill said it was seeking F.D.A. approval. Page A12.   ,The New York group holding the American patent rights to the French abortion pill said it was seeking F.D.A. approval. Page A12.,1996-04-01T05:00:00+0000
621,What Is the ‘Abortion Abolitionist’ Movement?,How a fringe faction has started to gain steam post Roe.,How a fringe faction has started to gain steam post Roe.,2022-07-02T00:21:40+0000
622,"‘Chaos and Confusion’ in States Where Abortion Is On Again, Off Again","For providers and patients, legal challenges to state abortion bans have meant navigating a situation in which the procedure may be allowed one day and banned the next.","For providers and patients, legal challenges to state abortion bans have meant navigating a situation in which the procedure may be allowed one day and banned the next.",2022-08-11T09:00:03+0000
623,Uphold the Abortion Veto,"Editorial contends that politically charged issue of abortion returns to Senate on Sept 26 in form of vote to override Pres Clinton's veto of bill outlawing certain late-term abortions and imposing criminal sanctions on doctors who perform them; notes that House recently voted 285 to 137 to override Clinton; maintains that leaves only Senate to stop this campaign-season rush to outlaw procedure that, despite its distasteful nature, remains safest method to abort fetus for valid medical reasons late in pregnancy (M)","The politically charged issue of abortion returns to the Senate today in the form of a vote to override President Clinton's veto of a bill outlawing certain late-term abortions and imposing criminal sanctions on doctors who perform them. Last week, the House voted by 285 to 137 to override Mr. Clinton. That leaves only the Senate to stop this campaign-season rush to outlaw a procedure that, despite its distasteful nature, remains the safest method to abort a fetus for valid medical reasons late in pregnancy.",1996-09-26T05:00:00+0000
624,G.O.P. Holds to Firm Stance on Abortion,"The Republican Party platform this year will reassert the party’s opposition to abortion, not allowing for exceptions in the cases of rape, incest or to save the life of the mother.","ST. PAUL  The Republican Party platform this year will reassert the party’s opposition to abortion. And again it will not allow for exceptions in the cases of rape, incest or to save the life of the mother, even though Senator John McCain, the presumptive presidential nominee, has long called for such exceptions.",2008-08-30T19:27:44+0000
625,"Abortion Politics, Money and the Reshaping of the G.O.P.","In “Dollars for Life,” Mary Ziegler argues that, over the course of decades, the anti-abortion movement laid the groundwork for an insurgent candidate like Donald Trump.","To hear more audio stories from publications like The New York Times, download Audm for iPhone or Android.",2022-06-12T09:00:05+0000
626,Inmate's Abortion Approved,"Judge Leonard N Arnold approves abortion request of prison inmate Sonya Jackson, after taking unusual step of appointing lawyer for her fetus; ACLU objects to appointment of legal guardian for fetus (New Jersey Daily Briefings)","After taking the unusual step of appointing a lawyer for a fetus, a Superior Court judge ruled yesterday that an inmate could go ahead with her abortion. The inmate, Sonya Jackson, who is in the second trimester of her pregnancy, had asked the judge, Leonard N. Arnold, for reduced bail so that she could leave jail for an abortion, but the judge told her that the fetus was entitled to legal representation.",1997-01-31T05:00:00+0000
627,What Can History Tell Us About the Roe Effect on the Midterms?,Finding analogies for big successes by the party out of power.,"Two weeks ago, I asked readers if they could think of a good historical analogy to the Supreme Court’s overturning of Roe v. Wade heading into a midterm election.",2022-09-28T09:00:10+0000
628,The New Assault on Abortion,Editorial regrets that Senate is gearing up for new contentious round in abortion debate; reports that this year's version of Republican legislation is no less objectionable than measure vetoed last year by Pres Clinton,"The Senate is gearing up for another contentious round on so-called ''partial-birth'' abortion, the controversial procedure saved from a Congressional ban last year by President Clinton's veto. In the meantime, many states have moved to outlaw the procedure on their own. Many of the state laws are as flawed as some of the bills rushing through Congress. They intrude on a woman's right to an abortion using the safest possible method as decided by her and her doctor.",1997-05-10T05:00:00+0000
629,A Bush Rule on Providers of Abortions Is Revised,The Obama administration says the 2008 rule upset the balance between the rights of patients and health care providers.,"WASHINGTON  The Obama administration on Friday rescinded most of a 2008 rule that granted sweeping protections to health care providers who opposed abortion, sterilization and other medical procedures on religious or moral grounds.",2011-02-19T01:21:47+0000
630,Partial-Truth Abortion,"Frank Rich Op-Ed column on confusing debate surrounding 'partial-birth abortions'; says no reliable statistics exist on exact number of such procedures each year, but number is relatively small because 99 percent of abortions occur in first 20 weeks; says pro-lifers are championing ban because it would be first step toward gutting Roe v Wade; says those who believe life begins at conception can logically argue that most abortions are 'partial-birth abortions' (M)","In the 24 years since Roe v. Wade, American women have never been more in danger of losing their constitutional right to an abortion than they are this week -- but so farcical, if far from funny, has been the debate surrounding ''partial-birth abortions'' that many Americans, Congressmen included, don't have a clue as to what is really going on.",1997-03-09T05:00:00+0000
631,Ruling in Abortion Protest,"  A judge today refused to dismiss two prior misdemeanor charges against the man accused of murdering an abortion clinic doctor and his volunteer escort on July 29.   Six weeks before the shotgun slayings of Dr. John D. Britton, 69, and his escort, James H. Barrett, 74, the man charged with their deaths, Paul J. Hill, was charged with disorderly conduct and violating the city's noise ordinance while protesting in front of an abortion clinic here.",A judge today refused to dismiss two prior misdemeanor charges against the man accused of murdering an abortion clinic doctor and his volunteer escort on July 29.,1994-08-31T05:00:00+0000
