,title,abstract,paragraph,pub_date
902,"In States Banning Abortion, a Growing Rift Over Enforcement",A reluctance by some liberal district attorneys to bring criminal charges against abortion providers is already complicating the legal landscape in some states.,"HOUSTON — Deep rifts have emerged among the hundreds of elected district attorneys who will be charged with enforcing the expanding restrictions on abortion, creating a Balkanized new legal system within states that are banning the procedure.",2022-06-29T21:41:55+0000
903,The Supremes: Late-Term Abortion,The passion of the protests outside the Supreme Court yesterday contrasted with the virtual medical seminar taking place inside as justices sought to learn more about late-term abortion.,"The passion of the protests outside the Supreme Court Wednesday contrasted with the virtual medical seminar taking place inside as justices sought to learn more about late-term abortion while considering the Partial-Birth Abortion Ban Act of 2003. Based on his questions, Justice Anthony M. Kennedy looks like he will cast the swing vote, but his direction is unclear.",2006-11-09T16:01:50+0000
904,Anti-Abortion Groups Continue Radical Talk,"  A New Year's message on the National Pro-Life Newsline today offered up an image of America's abortion clinics as a world of death camps, contract killers and mass murder.    Another telephone line, the Pro-Life Action News in Chicago, predicted an end to laws protecting abortion providers in 1995 and the reversal of a series of measures designed to safeguard women's rights to terminate unwanted pregnancies, even those that resulted from rape or incest.","A New Year's message on the National Pro-Life Newsline today offered up an image of America's abortion clinics as a world of death camps, contract killers and mass murder.",1995-01-01T05:00:00+0000
905,Alito called for reversal on abortion,,,2005-12-23T05:00:00+0000
906,Does This Abortion Decision Matter?,"The Los Angeles Times editorial on the Supreme Court decision upholding the federal Partial-Birth Abortion Ban Act includes a sentence that suggests Gonzales v. Carhart ultimately doesn’t mean very much for either side of the abortion debate: “This muddled decision doesn’t attack the basic holding of Roe v. Wade, and it will have no effect on the vast majority of abortions performed in this country.” ","The Los Angeles Times editorial on the Supreme Court decision upholding the federal Partial-Birth Abortion Ban Act includes a sentence that suggests Gonzales v. Carhart ultimately doesn’t mean very much for either side of the abortion debate: “This muddled decision doesn’t attack the basic holding of Roe v. Wade, and it will have no effect on the vast majority of abortions performed in this country.” ",2007-04-19T14:47:17+0000
907,An Early Tussle Over Abortion,"A parliamentary point of order about an abortion bill in the Texas House was the first tussle of the current legislative session, with both sides sizing up the competition.","Ross Ramsey, the managing editor of The Texas Tribune, writes a regular column for the Tribune.",2011-03-06T02:08:09+0000
908,Abortion Opponents Win Dispute,"The Supreme Court brought an end Tuesday to a 20-year effort by the National Organization for Women to hold a coalition of anti-abortion groups accountable for a campaign of disrupting and blockading abortion clinics during the 1980's.     Ruling 8 to 0, the court held that the Hobbs Act, a federal law that makes it a crime to use robbery, extortion or, under some circumstances, violence to obstruct commerce, did not provide a proper basis for the federal court injunction that NOW and two women's health clinics had obtained against groups like Operation Rescue.  ","WASHINGTON, Feb. 28 - The Supreme Court brought an end Tuesday to a 20-year effort by the National Organization for Women to hold a coalition of anti-abortion groups accountable for a campaign of disrupting and blockading abortion clinics during the 1980's.",2006-03-01T05:00:00+0000
909,Kerry and abortion : LETTERS TO THE EDITOR,"Joan Vennochi makes a common mistake in her characterization of John Kerry's view on abortion. The political debate suffers when commentators force politicians and others into abandoning nuance with respect to extremely complex and serious issues. Indeed,","Joan Vennochi makes a common mistake in her characterization of John Kerry's view on abortion. The political debate suffers when commentators force politicians and others into abandoning nuance with respect to extremely complex and serious issues. Indeed, most people are sophisticated enough to recognize that one can be both for a woman's right to choose to have an abortion, and against abortion itself, without any ambiguity or inconsistency.",2004-07-15T05:00:00+0000
910,Nicaragua Passes Total Ban on Abortion,"Nicaragua's legislature bans all abortions, eliminating exceptions for rape and when life of mother is threatened; vote is 52 to 0, with 9 abstentions and 29 representatives not showing up to vote; Pres Enrique Bolanos is expected to approve measure, making Nicaragua third country in Western hemisphere, after El Salvador and Chile, to ban abortion without exception; abortion is readily available only in Cuba and few English-speaking Caribbean countries; across Latin America, it is outlawed except in rare circumstances; ban in Nicaragua comes two weeks before hotly contested presidential election (M)","MEXICO CITY, Oct. 26 - Nicaragua's legislature on Thursday banned all abortions, eliminating exceptions for rape and when the life of the mother is threatened.",2006-10-27T05:00:00+0000
911,Abortion's Grim Alternatives,"LEAD: Given the fact that several Supreme Court justices are more than 80 years of age, George Bush will probably appoint enough justices during the next four years to make good his promise to outlaw most abortions. ''I favor adoption,'' he has said. ''Let them come to birth, and then put them in a family where there will be love.","LEAD: Given the fact that several Supreme Court justices are more than 80 years of age, George Bush will probably appoint enough justices during the next four years to make good his promise to outlaw most abortions. ''I favor adoption,'' he has said. ''Let them come to birth, and then put them in a family where there will be love.",1988-11-18T05:00:00+0000
912,Nominee opposed right to abortion,,,2005-10-19T05:00:00+0000
913,"As Passions Flare in Abortion Debate, Many Americans Say ‘It’s Complicated’","Abortion is anything but a simple issue. But the nuance in how most Americans think about it has all but disappeared from the political conversation, some voters say.","PITTSBURGH — Abortion is an issue that Lynndora Smith-Holmes goes back and forth on. “Six of one, half dozen of the other,” she said the other day as she finished her lunch break.",2019-06-15T12:22:14+0000
914,Kerry and abortion : LETTERS TO THE EDITOR,"Joan Vennochi (""Can two Johns make a JFK?"" Views, July 10) concludes that John Kerry's ""core convictions"" should be questioned because he voted for abortion rights while he says that he is personally against abortion. Is it really too","Joan Vennochi (""Can two Johns make a JFK?"" Views, July 10) concludes that John Kerry's ""core convictions"" should be questioned because he voted for abortion rights while he says that he is personally against abortion. Is it really too difficult to understand that one can have personal convictions yet respect the right of others to have different ones?",2004-07-15T05:00:00+0000
915,Levitt on Abortion/Crime Feedback,Death threats from liberals,Death threats from liberals,2007-09-19T23:24:15+0000
916,Nurses and Abortion,"Article by Mary Jane Tobin, pres of Nassau County chapter of Drs and Nurses vs Abortion Com, on difficulty, as a nurse, of participating in abortion","NURSES have traditionally been thought to be the guardians of life—to care for all human beings regardless of their age or condition. Yet, in abortion, they must stand by and watch a human life cease to be.",1977-01-30T05:00:00+0000
917,Tanzanian Women Face High Rates of Abortion-Related Deaths,"According to a recent study, deaths result from several factors and women in some regions die much more often than others.","Unsafe abortions kill many Tanzanian women, according to a recent study, but the deaths result from several factors and women in some regions die much more often than others.",2016-04-25T20:01:38+0000
918,Politicians React to Supreme Court’s Ruling on Abortion,"Democratic leaders condemned the court’s decision to overturn Roe v. Wade, while some Republican lawmakers celebrated the ruling.","Democratic leaders condemned the court’s decision to overturn Roe v. Wade, while some Republican lawmakers celebrated the ruling.",2022-06-24T21:29:33+0000
919,Abortion Protesters Tagged,"LEAD: Frustrated after a judge dismissed charges against 86 anti-abortion demonstrators whose police identifications he questioned, the Buffalo police used new methods in arresting more than 40 protesters over the weekend. Each suspect was tagged by number and photographed with the arresting officer.","Frustrated after a judge dismissed charges against 86 anti-abortion demonstrators whose police identifications he questioned, the Buffalo police used new methods in arresting more than 40 protesters over the weekend. Each suspect was tagged by number and photographed with the arresting officer.",1989-05-01T05:00:00+0000
920,Abortion Protesters Tagged,"LEAD: Frustrated after a judge dismissed charges against 86 anti-abortion demonstrators whose police identifications he questioned, the Buffalo police used new methods in arresting more than 40 protesters over the weekend. Each suspect was tagged by number and photographed with the arresting officer.","Frustrated after a judge dismissed charges against 86 anti-abortion demonstrators whose police identifications he questioned, the Buffalo police used new methods in arresting more than 40 protesters over the weekend. Each suspect was tagged by number and photographed with the arresting officer.",1989-05-01T05:00:00+0000
921,Frank Talk About Abortion,"Editorial details issues involved in debate over so-called partial birth abortion; notes abortion opponents openly use issue to chip away at access to legal abortion, strategy potent because clinical details of abortion are disturbing to consider; says controversy has created misimpression that late abortions are common and easy to obtain; notes ban on procedure provides no exception to protect woman's health; backs Supreme Court ruling in Roe v Wade that government should step in only when fetus is viable; urges Pres Bush and Congress to embrace wider range of approaches to avoiding unwanted pregnancies; warns efforts to restrict access to abortion lead to more later abortions","The current debate about so-called partial birth abortion has produced some strange and unfortunate consequences. Among the most disheartening is the widespread impression that the pro-choice movement does not regard abortion as a serious matter, and that women seeking to terminate a pregnancy require a condescending reminder from Congress to understand that the fetus they are carrying is a potential life.",2003-11-30T05:00:00+0000
922,Rivals Sharpen Their Positions on Abortion,"Atty Gen Eliot Spitzer vows that if elected governor of New York, he will support abortion rights, including late-term abortion; takes aim at Nassau County Exec Thomas R Suozzi, rival for Democratic nomination, who supports ban on so-called partial-birth abortions without exception; Naral Pro-Choice New York endorses Spitzer; photo (M)","Challenging a political rival over access to abortion, Eliot Spitzer, the leading Democratic candidate for governor, vowed support yesterday for any late-term abortion to protect the health or life of the mother, and said that New York needed a leader with that commitment in case the United States Supreme Court restricted abortion.",2006-02-10T05:00:00+0000
923,How Will We Punish the Women Who Have Abortions?,We can’t pretend that making it a criminal act won’t have consequences.,"In 2007 the conservative magazine National Review hosted an online symposium in response to a column by Anna Quindlen in Newsweek titled “How Much Jail Time for Women Who Have Abortions?” She argued that anti-abortion activists were dodging the reality that overturning Roe v. Wade would bring. If abortion became a crime in the United States, she wrote, those attempting to enforce such a law would have only two choices: “Hold women accountable for a criminal act by sending them to prison, or refuse to criminalize the act in the first place. If you can’t countenance the first,” she wrote, “you have to accept the second. You can’t have it both ways.”",2022-05-07T15:00:04+0000
924,7th Death in Medical Abortion,"Federal health authorities find seventh death linked to medical abortion, although woman who died did not take drug RU-486; announcement is made at FDA meeting of scientists from leading health agencies; six women have died after taking RU-486 since 2000, but officials are now looking into other factors (S)","ATLANTA, May 11 - Federal health authorities said Thursday that they had discovered a seventh death linked to a medical abortion, although the woman who died did not take the abortion drug RU-486.",2006-05-12T05:00:00+0000
925,"After Roe, South Carolina Considers More Restrictions on Abortion","The state legislature was the first to step into a post-Roe world, clearing the path for full bans in other conservative states.","COLUMBIA, S.C. — Nearly two weeks after the Supreme Court overturned the constitutional right to abortion established by Roe v. Wade, South Carolina lawmakers became the first to consider more restrictive legislation.",2022-07-07T23:26:21+0000
926,No Abortion Decision Yet,"LEAD: The Justices of the Supreme Court are apparently giving themselves one more weekend to decide two of the hardest cases of the term: the Missouri abortion case and one concerning the display of a Nativity scene in the government building of Allegheny County, Pa.","The Justices of the Supreme Court are apparently giving themselves one more weekend to decide two of the hardest cases of the term: the Missouri abortion case and one concerning the display of a Nativity scene in the government building of Allegheny County, Pa.",1989-06-30T05:00:00+0000
927,"Abortion, Intimidation and Death","LEAD: By capitulating to activists who regard abortion as immoral, a French company called Groupe Roussel Uclaf may be committing a larger immorality, ordaining the death of tens of thousands of women around the world. That's the judgment of people who should know - doctors attending the current World Congress of Gynecology and Obstetrics in Rio de","By capitulating to activists who regard abortion as immoral, a French company called Groupe Roussel Uclaf may be committing a larger immorality, ordaining the death of tens of thousands of women around the world. That's the judgment of people who should know - doctors attending the current World Congress of Gynecology and Obstetrics in Rio de Janeiro.",1988-10-28T05:00:00+0000
928,"Abortion, the Voters and the Court","LEAD: Voters in Tuesday's elections confirmed a new and startling political truth about abortion: The issue, once seemingly a winner for right-to-life candidates, can now punish these candidates at the polls. It can turn or swell the tide for pro-choice candidates like James Florio in New Jersey, Douglas Wilder in Virginia and David Dinkins in New York City.","Voters in Tuesday's elections confirmed a new and startling political truth about abortion: The issue, once seemingly a winner for right-to-life candidates, can now punish these candidates at the polls. It can turn or swell the tide for pro-choice candidates like James Florio in New Jersey, Douglas Wilder in Virginia and David Dinkins in New York City. Energized by a hostile Supreme Court, the defenders of a woman's right to choose are no longer on the defensive.",1989-11-13T05:00:00+0000
929,"Abortion, Gay Marriage and Money",A few odds and ends of news at week’s end.,This week ends with news headlines and personalities that send us right back to the 2008 campaign. Sarah Palin. Abortion. Steve Schmidt. Gay Marriage. Campaign finance reports. ,2009-04-17T21:41:41+0000
930,HIGH COST OF ABORTIONS,Lrs on K Munroe Dec 29 article criticizing Calif's reform law,,1969-01-12T05:00:00+0000
931,"Pressing for Abortion, in the Name of Family","LEAD: FOR the organized women's movement, last Sunday's march in Washington was an occasion for renewal. It provided a small jolt to those who thought that something called feminism was dead and reminded this city that mass protest was not just something out of the 1960's.","FOR the organized women's movement, last Sunday's march in Washington was an occasion for renewal. It provided a small jolt to those who thought that something called feminism was dead and reminded this city that mass protest was not just something out of the 1960's.",1989-04-16T05:00:00+0000
932,Abortion Foes Aim to Compete With Turnout for Women’s March,This year’s anti-abortion march in Washington – the 44th annual March for Life — was expected to be a celebratory event at which abortion foes could savor a few wins.,Opponents of abortion watching the women’s march on their televisions last Saturday stewed as they saw the Planned Parenthood logo over the stage and the actress Scarlett Johansson praising the group for the gynecological care she received as a teenager.,2017-01-26T07:00:26+0000
933,7th Death in Medical Abortion,"Federal health authorities linked another woman's death to a medical abortion, but they said the woman did not take the drug RU-486 used by six others who died.","ATLANTA, May 11  Federal health authorities said Thursday that they had discovered a seventh death linked to a medical abortion, although the woman who died did not take the abortion drug RU-486.",2006-05-12T04:00:00+0000
934,Abortion Law Challenged,"W R Baird, birth-control advocate, challenges Mass abortion law in suit",,1969-06-03T05:00:00+0000
935,Michigan Judge Suspends an Abortion Ban From 1931,The law is obsolete because of Roe v. Wade but still on the books. Abortion rights advocates are worried that a potential Supreme Court ruling overturning Roe will revive it.,A Michigan judge has pre-emptively blocked enforcement of a 1931 law that would ban abortions in almost all cases if the Supreme Court takes an expected step to overturn the constitutional right to abortion.,2022-05-17T23:55:36+0000
936,Abortion Restriction Advances in Senate,"The Senate rejected Democratic efforts yesterday to change or delay a ban on a disputed abortion procedure, and it was all but certain that the body, controlled by Republicans, would adopt the measure today.  ","The Senate rejected Democratic efforts yesterday to change or delay a ban on a disputed abortion procedure, and it was all but certain that the body, controlled by Republicans, would adopt the measure today.",2003-03-13T05:00:00+0000
937,Delinking Abortion and Breast Cancer,"Editorial says National Cancer Institute study has determined unequivocally that that there is no association between abortions and breast cancer; says if science prevails, new study should provide antidote to scaremongering by anti-abortion groups","A crude effort by anti-abortion groups and their supporters in Congress to associate abortion with an increased risk of breast cancer can now be stopped in its tracks. A definitive scientific judgment has been rendered on this overheated issue. The best minds that could be assembled by the National Cancer Institute have determined unequivocally that no such link exists. The epidemiological evidence to support this conclusion is considered ''well established,'' the highest of four categories of proof in the government's rankings of strength of evidence.",2003-03-11T05:00:00+0000
938,Abortion Court Named,judges named,,1969-11-07T05:00:00+0000
939,Decline in Abortions Reported,LEAD: Federal health officials have reported a decrease in the number of abortions in the United States for the first time since record-keeping began in 1969.,Federal health officials have reported a decrease in the number of abortions in the United States for the first time since record-keeping began in 1969.,1987-08-25T05:00:00+0000
940,A ’95/10’ Plan on Abortion,,,2006-02-17T13:52:14+0000
941,Medical Definitions of Abortion Techniques,"WASHINGTON, Nov. 5 (AP) — Abortion restrictions being signed into law today are creating confusion over just what the ban covers."," WASHINGTON, Nov. 5 (AP) — Abortion restrictions being signed into law today are creating confusion over just what the ban covers. ",2003-11-05T05:00:00+0000
942,Court Nudged On Abortions,"  Though no Federal statutes are involved in the abortion-law appeals pending before the United States Supreme Court, the Justice Department made good on Attorney General William French Smith promise to encourage ''judicial restraint'' in cases involving social issues.   In a move that delighted antiabortion groups and others who regard Federal judges as overly meddlesome, it weighed in with an unusual ''friend of the court brief.''","Though no Federal statutes are involved in the abortion-law appeals pending before the United States Supreme Court, the Justice Department made good on Attorney General William French Smith promise to encourage ''judicial restraint'' in cases involving social issues.",1982-08-01T05:00:00+0000
943,A Community Divided Over Abortion,,,2006-10-31T15:42:00+0000
944,Stalling on Abortion Reform,ed deplores stalling,,1969-03-14T05:00:00+0000
945,Abortion Reform Urged,Amer Bapt Conv delegates adopt resolution calling for liberalization of abortion laws; details,,1968-06-02T05:00:00+0000
946,"Biden Issues Executive Order on Abortion Access, Calling for More Study","The order is short on specifics, directing federal officials to consider how to help those traveling out of state for abortions.","WASHINGTON — Since even before the Supreme Court struck down Roe v. Wade, Democrats have pressured President Biden to take action to protect abortion rights.",2022-08-03T11:16:17+0000
947,Are abortion medications delivered by mail illegal?,"The end of Roe v. Wade will make little immediate difference on access to medications, though legal experts say that could change as more trigger laws are certified.","It is still legal in most states to receive abortion medication by mail, which has been allowed since December 2021, when the Food and Drug Administration lifted a restriction that required patients to obtain the pills from a certified provider.",2022-06-24T21:56:22+0000
