,title,abstract,paragraph,pub_date
318,The Abortion Question,"Nicholas D Kristof Op-Ed column on abortion controversy suggests that recent events in Portugal illustrate what might happen in America if Pres Bush gets his way with Supreme Court on abortion issue; cites two mass abortion trials in Portugal, in which 49 women were tried for having abortions, and all were acquitted except for a nurse who was sentenced to eight and half years in prison for performing abortions; observes that Portugal, like United States, is industrialized democracy with conservative religious streak, but that trials have repulsed Portuguese; contends Portugal offers sobering lessons for Americans who, like Pres Bush, aim to overturn Roe v Wade; asserts that abortion laws are very difficult to enforce in world as mobile as ours; holds that if states did criminalize abortion, they would face backlash as public focus shifts from fetus to the woman (M)","To understand what might happen in America if President Bush gets his way with the Supreme Court, consider recent events in Portugal.",2004-04-07T05:00:00+0000
319,The Archbishop and Abortion,"""I believe in an America where the separation of church and state is absolute--where no Catholic prelate would tell the President (should he be Catholic) how to act, and no Protestant minister would tell his parishioners for whom to vote...""  ",,1980-09-19T05:00:00+0000
320,Posturing on Abortion,"Editorial says so-called Child Custody Protection Act, which won approval in House, is in fact latest scheme to curb abortion rights by opponents of women's reproductive freedom; says measure would endanger lives of desperate young women seeking abortions by denying them assistance from any adult other than parent to acccompany them across state lines seeking abortion; notes this is third time House has passed this proposal; holds, now with Republican in White House, it is crucial that Senate majority leader Tom Daschle rally his pro-choice colleagues to keep this measure from reaching Pres Bush","In recent years, opponents of women's reproductive freedom have come up with increasingly creative schemes to curb abortion rights. One of the newest and most deceptive of these, the egregiously mislabeled Child Custody Protection Act, won easy approval in the House on Wednesday. Far from protecting vulnerable minors, the measure's actual result would be to endanger the lives of desperate young women seeking abortions by denying them assistance from their grandparents or other trusted adults.",2002-04-19T05:00:00+0000
321,The Federal Government Subsidizes Abortions. Will That Last?,Individuals can often use health insurance or flexible spending accounts to pay for abortions or deduct the cost on tax returns. Congress might weigh in.,"In the United States, you can get a tax deduction for your abortion if your overall health care expenses are high enough. That didn’t change with the Supreme Court’s ruling last week.",2022-07-02T07:00:10+0000
322,Ashcroft on Abortion,"John Ashcroft told the Senate Judiciary Committee that if confirmed as attorney general he would not seek any opportunities to challenge the Supreme Court's ruling upholding abortion rights, which momentarily alarmed some of his supporters in the anti-abortion movement.    Article, Page A16.","John Ashcroft told the Senate Judiciary Committee that if confirmed as attorney general he would not seek any opportunities to challenge the Supreme Court's ruling upholding abortion rights, which momentarily alarmed some of his supporters in the anti-abortion movement.",2001-01-18T05:00:00+0000
323,"In New York, Anti-Abortion Centers Outnumber Abortion Clinics","Crisis pregnancy centers, which encourage women to give birth, prepare for a post-Roe world in a state that is considered a bastion of abortion rights.","Patricia Clinton was walking up East 149th Street in the South Bronx one afternoon last fall, ruminating over her decision to end an unexpected pregnancy. She was five weeks along, already a single parent to two children, and her finances were unstable. She wasn’t sure if the father of her unborn child would remain in the picture and didn’t think she could handle feeding a third mouth on her own.",2022-06-25T09:00:21+0000
324,Abortion Internet Site,"Doctors and Planned Parenthood officials say they will continue to provide abortion services in Westchester County, NY, despite listings on anti-abortion Internet site (S)","A Westchester doctor who provides fertility and abortion services and a former police chief are listed on an Internet site that tracks doctors who perform abortions, along with their staffs, law enforcement authorities and others who have supported abortion. It is the same Internet site that listed Dr. Barnett A. Slepian of Buffalo and then crossed out his name when he was shot and killed.",1998-11-08T05:00:00+0000
325,How to Interpret the Kansas Referendum on Abortion,Voters in the conservative state roundly rejected a measure that would have added a constitutional prohibition.,This episode contains mention of sexual assault.,2022-08-04T10:00:08+0000
326,Uncharted Territory on Abortion Politics,"Abortion rights groups responded to our story, claiming political momentum heading into 2020.","Hi. Welcome to On Politics, your guide to the day in national politics. I’m Lisa Lerer, your host, along with my colleague Elizabeth Dias, our religion reporter.",2019-12-03T00:30:04+0000
327,Spain’s Alarming Abortion Debate,The country could be the first European Union member to retreat on reproductive rights.,"Spain’s conservative Popular Party, led by Prime Minister Mariano Rajoy, is pushing a bill that would restrict reproductive rights so severely that many women would be forced to travel abroad to seek abortions or turn to illegal and risky procedures. The bill would allow abortion only in the case of rape or grave danger to the health of the mother as determined by two independent medical professionals. Minors who seek abortions would need parental approval. Fetal abnormalities would no longer qualify as a reason to terminate a pregnancy. If the bill is passed, Spain will become the first member of the European Union to retreat from a decades-long trend toward safe and legal abortion. ",2014-01-17T10:53:21+0000
328,California Expands Availability of Abortions,"Gov. Jerry Brown signed a bill allowing nurse practitioners, midwives and physician assistants to perform aspiration abortions during the first trimester.","LOS ANGELES — Gov. Jerry Brown on Wednesday expanded access to abortion in California, signing a bill to allow nurse practitioners, midwives and physician assistants to perform a common type of the procedure, an aspiration abortion, during the first trimester.",2013-10-10T00:36:12+0000
329,Kansas Abortion Amendment Election Results ,See full results and maps from the Kansas primary elections.,See full results and maps from the Kansas primary elections.,2022-08-03T16:09:10+0000
330,"Abortion in Italy, a Right Wronged",Why do 7 out of 10 Italian gynecologists refuse to terminate pregnancies when the procedure is legal?,"Late last month, Cosimo Borraccino, a left-wing member of the regional council for Apulia, in southern Italy, proposed passing a local law to require the enforcement of national legislation granting women access to abortion. His opponents on the council, mostly from center-right parties, said the bill was unnecessary and that Mr. Borraccino was “slamming into a wall of self-evidence.”",2017-11-13T08:06:35+0000
331,A Perilous Year for Abortion Rights ,"State battles continue over aggressive limitations, and bills with bad old ideas are introduced in the new Republican-controlled Congress.","The start of 2015 finds no letup in the attacks on a woman’s constitutionally protected right to make her own childbearing decisions. Republican lawmakers and organizations devoted to dismantling reproductive freedom have succeeded in shrinking the already inadequate number of abortion providers, making it exceedingly difficult, if not impossible, for women — especially young and poor women — to obtain safe and legal abortion services in large swaths Texas and other parts of the country. ",2015-01-20T08:27:21+0000
332,Mississippi Explains All on Abortion,The state’s attorney general is asking the Supreme Court to overturn Roe v. Wade.,"Attorney General Lynn Fitch of Mississippi made nationwide news last week when she asked the Supreme Court to overturn its two leading precedents on the right to abortion, Roe v. Wade and Planned Parenthood v. Casey. I was puzzled by the treatment of this filing as news, unless the news was that a state finally came clean with the court and told the justices what it really wanted them to do.",2021-07-29T09:00:17+0000
333,The Invisible Hand of Justice Stevens on Abortion,He was a leading if often unseen strategist who helped protect a woman’s right to choose.,"During the days following the death last Tuesday of Justice John Paul Stevens, admirers posted lists of their favorite and not-so-favorite Stevens opinions. Free speech on the internet?  A great one. No First Amendment protection for burning an American flag?  Not so great. Access to federal court for Guantánamo detainees?  Definitely. Upholding an Indiana voter ID requirement? Hmm … ",2019-07-20T18:30:05+0000
334,"Economics, and Humanity, of Abortion Bill","Unlike a 2007 anti-abortion bill that stalled in the Texas House, the new law does not try to calculate its economic or human costs.","Six years ago, a major anti-abortion bill stalled in the Texas House after a $1 billion price tag was attached. ",2013-07-25T22:19:12+0000
335,An Abortion Ban’s Bogus Arguments,Conservative Republicans are trying to undercut women’s constitutionally protected reproductive rights — yet again.,"For the second time in two years, the House  voted Wednesday to pass legislation that would ban almost all abortions 20 weeks or more after fertilization. The bill, called the Pain-Capable Unborn Child Protection Act, claims that “an unborn child is capable of experiencing pain at least by 20 weeks after fertilization,” though medical evidence does not support this. ",2015-05-14T17:35:47+0000
336,Ireland’s Long Journey on Abortion,Thousands of women a year have to travel abroad for treatment because of a constitutional ban. But public opinion is shifting.,"DUBLIN — “Not the first or the last bleeding women about to face a long trek home.” This was one of the tweets sent this month to the Irish prime minister, Enda Kenny, from a woman who was traveling abroad for an abortion.",2016-09-02T11:26:10+0000
337,Justices Decline an Appeal on Abortion,A ruling by the Oklahoma Supreme Court last week that a law violated the Constitution by effectively banning medicinal abortions apparently made the case less attractive to the higher court.,"WASHINGTON — The Supreme Court decided on Monday not to hear an appeal from a decision striking down an Oklahoma abortion law after all, dismissing as “improvidently granted” a case it had agreed to consider in June.",2013-11-04T16:56:52+0000
338,Abortion Politics,"In a move that seems as much a matter of politics as principle, Congress has  voted to outlaw a particular type of late-term abortion method and impose criminal penalties on doctors who use it. Last week's vote in the House sends the bill to President Clinton, who has threatened a veto. The fact that the abortion issue is always volatile in a Presidential election year should not prevent Mr. Clinton from carrying out his threat.         The procedure to be banned, called a ""partial birth"" abortion in the bill and by anti-abortion groups, is used only after 20 weeks of gestation. While statistics are hard to come by, the method does not seem to be used often. About 13,000 of the nation's 1.5 million abortions each year are performed after 20 weeks, usually because of special circumstances, such as a threat to the mother's health or severe fetal abnormalities. Only a small percentage of these  late abortions employ the outlawed method.   ","In a move that seems as much a matter of politics as principle, Congress has voted to outlaw a particular type of late-term abortion method and impose criminal penalties on doctors who use it. Last week's vote in the House sends the bill to President Clinton, who has threatened a veto. The fact that the abortion issue is always volatile in a Presidential election year should not prevent Mr. Clinton from carrying out his threat.",1996-03-31T05:00:00+0000
339,Abortion Warning,"  Opponents of the anti-abortion policy in the 1984 Republican Party platform plan to emphasize in the fall campaign that the re- election of President Reagan would be likely to produce a turnover in the Supreme Court that could reverse the Court's 1973 abortion ruling, whatever the majority view of Congress or the voters might be at the time.     The National Abortion Rights Action League is circulating a memorandum that cites with some apprehension a 1983 Supreme Court minority opinion by Associate Justice Sandra Day O'Connor, the only High Court appointee of President Reagan's first term, and warns that it could become the majority view on abortion in the course of a second term.","Opponents of the anti-abortion policy in the 1984 Republican Party platform plan to emphasize in the fall campaign that the re- election of President Reagan would be likely to produce a turnover in the Supreme Court that could reverse the Court's 1973 abortion ruling, whatever the majority view of Congress or the voters might be at the time.",1984-09-03T05:00:00+0000
340,Foreign Aid and Abortion Rights ,It’s time to end a blanket ban that stems from a misinterpretation of the Helms amendment.,"A small provision tucked in the new federal spending bill ends a longstanding injustice by easing a 1979 rule that prohibited the Peace Corps from providing any abortion coverage for female volunteers, who now make up nearly two-thirds of those who serve.",2014-12-29T00:17:51+0000
341,Abortion's Children,"Peggy Noonan Op-Ed article, on 25th anniversary of Supreme Court's Roe v Wade decision, holds that 'abortion culture' in which today's young people have grown up has created in them a moral confusion and feeling that human life is neither special nor sanctified (M)","On the 25th anniversary of Roe v. Wade, we know certain facts. We know that at this point about 1.5 million abortions are performed each year in the United States. And we know that the fight over whether legalized abortion should continue has not waned with time, as many thought it would, but grown.",1998-01-22T05:00:00+0000
342,The Policy and the Politics of the Abortion Debate,Abortion periodically becomes a legislative issue and then slips into the background almost long enough for everyone to forget how potent it is.,"Ross Ramsey, the executive editor of The Texas Tribune, writes a regular column for the Tribune.",2013-07-14T03:20:40+0000
343,  The Abortion Account,"LEAD: When I was growing up my life was governed by nuns and priests. Don't scratch in public, Sister said. Don't roll your skirt up, Sister said. Don't whisper in class. Don't gossip. Don't cheat.  The priests were always more remote. What I remember best is the outline of their profiles against the confessional screen, and the low murmur as they repeated the words of absolution while I said my act of contrition.","When I was growing up my life was governed by nuns and priests. Don't scratch in public, Sister said. Don't roll your skirt up, Sister said. Don't whisper in class. Don't gossip. Don't cheat. The priests were always more remote. What I remember best is the outline of their profiles against the confessional screen, and the low murmur as they repeated the words of absolution while I said my act of contrition. In a church so often devoted to conformity and crowds, this seemed the great individual act, the confession of one soul, examining her conscience.",1990-04-08T05:00:00+0000
344,Abortion Protester Is Killed in Michigan,"A man who had long been vocal in his opposition to abortion was shot to death outside a high school while staging an anti-abortion protest, authorities said.","A man who had long opposed abortion and was known nationally among anti-abortion protesters was shot to death Friday morning while staging a protest outside a Michigan high school, the authorities said. ",2009-09-11T18:37:30+0000
345,Posturing on Abortion,"The indignant voices of the pro-life movement and the Republican Party will likely reach new decibels in the campaign to urge Congress to override President Clinton's veto of the bill banning so-called partial-birth abortions. But Congress should sustain the veto. The bill does not provide an exception for women whose health is at risk, and it would be virtually unenforceable.         I write this as a Jesuit priest who agrees with Vatican II, which said abortion is virtually infanticide, and as a lawyer who wants the Clinton Administration to do more to carry out its pledge to make abortions rare in this country.   ","The indignant voices of the pro-life movement and the Republican Party will likely reach new decibels in the campaign to urge Congress to override President Clinton's veto of the bill banning so-called partial-birth abortions. But Congress should sustain the veto. The bill does not provide an exception for women whose health is at risk, and it would be virtually unenforceable.",1996-06-04T05:00:00+0000
346,Google in Shift on ‘Abortion’ as Keyword,"After a lawsuit from a Christian anti-abortion group, Google is now allowing religious organizations to take out ads using the keyword “abortion.”","After a lawsuit from a Christian anti-abortion group, Google is allowing religious organizations to take out ads using the keyword “abortion,” a rare case of the search giant admitting it was wrong.",2008-09-21T22:04:20+0000
347,The Abortion Riddle,"LEAD: After all the emotion of the Missouri abortion case, inside and outside the Supreme Court, the hard questions remain. Is the Court on the way to overruling Roe v. Wade completely? Is a majority ready to say that women have no meaningful right to decide for themselves whether to terminate a pregnancy?","After all the emotion of the Missouri abortion case, inside and outside the Supreme Court, the hard questions remain. Is the Court on the way to overruling Roe v. Wade completely? Is a majority ready to say that women have no meaningful right to decide for themselves whether to terminate a pregnancy?",1989-07-06T05:00:00+0000
348,Abortion Opportunity,"A stunning breakthrough took place last week in America's generation-long abortion debate. The center suddenly became very much wider and genuine compromise is possible.    No matter how often or rarely doctors perform partial-birth abortion, most Americans want it outlawed. The moment one foot enters the world, a baby being born in the U.S. should have an inalienable right to life and to all the protections of every human being under our Constitution.  ",A stunning breakthrough took place last week in America's generation-long abortion debate. The center suddenly became very much wider and genuine compromise is possible.,1997-05-18T05:00:00+0000
349,Shift in Virginia on Abortion Bill,Gov. Bob McDonnell said he wanted an amendment stipulating that pre-abortion ultrasounds be limited to a non-invasive abdominal scan.,Gov. Bob McDonnell of Virginia backed down on Wednesday on a bill requiring women to have a vaginal ultrasound before undergoing an abortion. It was a sudden change of position for a conservative governor who is viewed as having political ambitions on the national stage. ,2012-02-22T21:27:21+0000
350,Drive for Vote on Abortion Accelerates,Abortion rights advocates plan final push for signatures to petition that could send South Dakota's abortion ban to statewide vote in November; advocates have decided to file signatures May 30 after hearing of possible legal challenge to referendum from supporters of ban (M),"Advocates of abortion rights were planning a final push this weekend for signatures to a petition that could send South Dakota's ban on abortion, which was intended as a direct legal challenge to the 1973 Supreme Court decision that established a constitutional right to abortion, to a statewide vote in November.",2006-05-27T05:00:00+0000
351,China: Crackdown on Abortion of Girls,"Chinese authorities closed 201 medical clinics in northern Hebei Province and fined several hundred others because they helped detect and abort female fetuses, the New China News Agency said. The government has been trying to cut down on selective-sex abortions, which are partly responsible for a lopsided birth ratio of 117 male births to 100 female births. It has long banned medical personnel from disclosing the sex of a fetus. But the practice remains widespread because China enforces strict population controls.","Chinese authorities closed 201 medical clinics in northern Hebei Province and fined several hundred others because they helped detect and abort female fetuses, the New China News Agency said. The government has been trying to cut down on selective-sex abortions, which are partly responsible for a lopsided birth ratio of 117 male births to 100 female births. It has long banned medical personnel from disclosing the sex of a fetus. But the practice remains widespread because China enforces strict population controls.",2006-06-01T04:00:00+0000
352,Drive for Vote on Abortion Accelerates,Advocates are finishing their push to gather signatures on a petition that could send South Dakota's ban on abortion to a statewide vote in November.," Advocates of abortion rights were planning a final push this weekend for signatures to a petition that could send South Dakota's ban on abortion, which was intended as a direct legal challenge to the 1973 Supreme Court decision that established a constitutional right to abortion, to a statewide vote in November. ",2006-05-27T04:00:00+0000
353,The Abortion I Didn’t Have,"I never thought about ending my pregnancy. Instead, at 19, I erased the future I had imagined for myself.","He was born on New Year’s Day, the year 2000. I got pregnant with him when I was 19, a month before I graduated from college. I was a brain; that was my identity. I was headed to Yale Divinity School, where I would study for a master’s in religion and literature. Those were my interests: religion, literature, study. I had not thought about having children or being a wife. I hadn’t thought I wouldn’t do those things, but if I thought about them, they existed in the vague haze of my distant future.",2021-12-02T10:00:15+0000
354,Abortion Rises Anew for Giuliani,Rudolph Giuliani did not cite values as a theme of his campaign at a gathering of conservatives Monday.,"WASHINGTON, May 7  Rudolph W. Giuliani told a gathering of conservatives Monday that his campaign could be boiled down to two major themes: national security and economic security.",2007-05-08T04:00:00+0000
355,Alabama’s Terrible Law Doesn’t Have to Be the Future of Abortion,"A self-induced abortion with misoprostol can be a safe, reliable way to end an unwanted pregnancy.",This story has been updated to reflect news developments.,2019-05-11T11:00:05+0000
356,The Roberts Court Takes on Abortion,"The Supreme Court heard arguments on the federal Partial-Birth Abortion Ban Act on Wednesday, but this time, it is not the same old debate.",WASHINGTON ,2006-11-05T05:00:00+0000
357,Nuances on Abortion,"The flap over what Ralph Reed really believes about abortion had a clear beginning. He was trying to create some wiggle room for his friend Bob Dole on the most divisive issue facing the Senator's party and his Presidential campaign. In that sense, Mr. Reed was offering help with a problem that he and his allies had created.         As executive director of the Christian Coalition, he is part of the movement  that put the rigid pro-life plank in the G.O.P. platform. It opposes any infringement on an unborn child's ""right to life' and demands a ""Human Life Amendment"" to the Constitution. In a new book, however, Mr. Reed now argues that while many pro-lifers would regard any change in that platform as ""anathema,"" it is possible to offer alternative ""morally compelling"" language. His own alternative speaks generally about the need for ""all legal and constitutional means"" to protect the unborn but omits any mention of a constitutional amendment.   ","The flap over what Ralph Reed really believes about abortion had a clear beginning. He was trying to create some wiggle room for his friend Bob Dole on the most divisive issue facing the Senator's party and his Presidential campaign. In that sense, Mr. Reed was offering help with a problem that he and his allies had created.",1996-05-08T05:00:00+0000
358,The Scandal Of Abortion -- Laws; Abortion Laws,"L Lader article urging liberalization of abortion laws revs moral, ethical and legal arguments",,1965-04-25T05:00:00+0000
359,"Abortion, Back at the Supreme Court","The justices face two fundamental issues in a case involving a law whose purpose is to end safe, legal procedures.","On Friday, the Supreme Court agreed to hear a case that involves one of the most serious threats to women’s reproductive freedom since Roe v. Wade.",2015-11-14T00:10:42+0000
